{
  "$schema": "http://json-schema.org/draft-07/schema#",
  "$id": "https://cpokuru.github.io/CoreRDK-Broadband-Platform/schemas/cpu-utilization.schema.json",
  "title": "RDK-B Core Broadband CPU Utilization by Process",
  "description": "Per-profile CPU utilization by process, answering 'what consumes the CPU minimum'. Sibling file to memory-footprint.schema.json and flash-layout.schema.json, kept separate from hw-compat.schema.json so utilization data can be added as components are profiled without touching the CPU/RAM/flash/peripheral spec file.",
  "type": "object",
  "required": ["specVersion", "profileId", "measured", "processes"],
  "properties": {
    "specVersion": {
      "type": "string",
      "description": "Version of this JSON schema (semantic version), e.g. \"1.0\"."
    },
    "profileId": {
      "type": "string",
      "description": "Matches the profileId in the corresponding hw-compat.schema.json file for this profile."
    },
    "measured": {
      "type": "boolean",
      "description": "True if CPU utilization has been measured on a reference device for at least one process; false if this profile is pending profiling."
    },
    "referenceDevice": {
      "type": "string",
      "description": "Optional. Device the measurement was taken on, e.g. \"BPI-R4 (MediaTek MT7988, Filogic)\"."
    },
    "measurementCondition": {
      "type": "string",
      "description": "Optional. What state the device was in when measured, e.g. \"idle, no active clients\" or \"steady-state, 4 Wi-Fi clients, 500 Mbps WAN throughput\". CPU utilization is highly workload-dependent, so this matters as much as the numbers."
    },
    "lastMeasured": {
      "type": "string",
      "format": "date",
      "description": "Optional. ISO-8601 date (YYYY-MM-DD) of the most recent measurement pass."
    },
    "totalCpuPercent": {
      "type": "number",
      "description": "Optional. Aggregate CPU utilization (%, summed across cores) across all processes at the measurement condition above."
    },
    "processes": {
      "type": "array",
      "description": "Per-process CPU utilization entries, typically sorted descending. Empty when measured is false.",
      "items": {
        "type": "object",
        "required": ["process", "cpuPercent"],
        "properties": {
          "process": { "type": "string", "description": "Process or component name, e.g. \"OneWifi\"." },
          "cpuPercent": {
            "anyOf": [{ "type": "number" }, { "type": "string", "enum": ["TBD"] }],
            "description": "CPU utilization in percent (of one core) at the stated measurement condition, or \"TBD\" if not yet measured."
          },
          "componentRepo": { "type": "string", "description": "Optional. RDK-B Component List repo name for cross-reference." }
        }
      }
    },
    "othersCpuPercent": {
      "type": "number",
      "description": "Optional. Aggregate CPU utilization for remaining processes not individually broken out."
    },
    "notes": {
      "type": "string",
      "description": "Optional. Free-text notes, e.g. explaining measurement methodology or why a profile is unmeasured."
    }
  }
}
