{
  "$schema": "https://cpokuru.github.io/CoreRDK-Broadband-Platform/schemas/cpu-utilization.schema.json",
  "specVersion": "1.0",
  "profileId": "ethwan-wifi-router",
  "measured": true,
  "referenceDevice": "BPI-R4 (MediaTek MT7988A/Filogic 880), combined EthWAN + EasyMesh Controller/Agent build (production-style image)",
  "measurementCondition": "60-second aggregate and per-process /proc/stat and /proc/<pid>/stat time-delta sample; all 4 cores online at governor default; light real-world background activity (OneWifi, snmpd, and napi/phy0 Wi-Fi softirq threads all show measurable, nonzero activity, indicating some radio activity during the window) but no controlled client/traffic load applied. Not a controlled loaded-workload test.",
  "lastMeasured": "2026-09-17",
  "totalCpuPercent": 3.57,
  "processes": [
    {
      "process": "OneWifi",
      "cpuPercent": 0.55
    },
    {
      "process": "snmpd",
      "cpuPercent": 0.24
    },
    {
      "process": "napi/phy0-15",
      "cpuPercent": 0.23
    },
    {
      "process": "netlink-button-",
      "cpuPercent": 0.03
    },
    {
      "process": "asterisk",
      "cpuPercent": 0.03
    },
    {
      "process": "ieee1905",
      "cpuPercent": 0.03
    },
    {
      "process": "ieee1905",
      "cpuPercent": 0.03
    },
    {
      "process": "CcspPandMSsp",
      "cpuPercent": 0.03
    },
    {
      "process": "PsmSsp",
      "cpuPercent": 0.03
    },
    {
      "process": "rtrouted",
      "cpuPercent": 0.03
    },
    {
      "process": "CcspTr069PaSsp",
      "cpuPercent": 0.02
    },
    {
      "process": "napi/phy0-14",
      "cpuPercent": 0.02
    },
    {
      "process": "CcspTandDSsp",
      "cpuPercent": 0.02
    },
    {
      "process": "syseventd",
      "cpuPercent": 0.02
    },
    {
      "process": "self_heal_conne",
      "cpuPercent": 0.01
    },
    {
      "process": "cellularmanager",
      "cpuPercent": 0.01
    },
    {
      "process": "wanmanager",
      "cpuPercent": 0.01
    },
    {
      "process": "onewifi_em_agent",
      "cpuPercent": 0.01
    },
    {
      "process": "systemd-journald",
      "cpuPercent": 0.01
    },
    {
      "process": "onewifi_em_ctrl",
      "cpuPercent": 0.01
    },
    {
      "process": "IGD",
      "cpuPercent": 0.01
    },
    {
      "process": "CcspLMLite",
      "cpuPercent": 0.01
    },
    {
      "process": "sh",
      "cpuPercent": 0.01
    },
    {
      "process": "napi/phy0-17",
      "cpuPercent": 0.01
    },
    {
      "process": "napi/phy0-16",
      "cpuPercent": 0.01
    },
    {
      "process": "systemd",
      "cpuPercent": 0.01
    },
    {
      "process": "parodus",
      "cpuPercent": 0.01
    },
    {
      "process": "webpa",
      "cpuPercent": 0.01
    },
    {
      "process": "obuspa",
      "cpuPercent": 0.01
    },
    {
      "process": "dibbler-client",
      "cpuPercent": 0.01
    },
    {
      "process": "CcspXdnsSsp",
      "cpuPercent": 0.01
    },
    {
      "process": "crond",
      "cpuPercent": 0.01
    },
    {
      "process": "CcspDHCPMgr",
      "cpuPercent": 0.01
    },
    {
      "process": "VlanManager",
      "cpuPercent": 0.01
    },
    {
      "process": "telcovoice_manager",
      "cpuPercent": 0.01
    },
    {
      "process": "CcspEthAgent",
      "cpuPercent": 0.01
    },
    {
      "process": "DobbyDaemon",
      "cpuPercent": 0.01
    },
    {
      "process": "hal-voice-asterisk",
      "cpuPercent": 0.01
    },
    {
      "process": "CcspAdvSecurity",
      "cpuPercent": 0.01
    },
    {
      "process": "mt76-tx phy0",
      "cpuPercent": 0.01
    }
  ],
  "othersCpuPercent": 2.0,
  "notes": "First real per-process CPU breakdown captured for this profile (prior captures had only the aggregate figure). Per-process percentages are normalized to % of total system capacity across all 4 cores, matching the aggregate figure's own normalization \u2014 NOT % of a single core. (An earlier version of this capture's tooling computed per-process percentages against one core only, which does not sum consistently against a multi-core aggregate; that has been corrected here.) othersCpuPercent (2.0%) covers kernel worker threads (kworker/*, ~0.16% of that) plus many near-idle kernel/IRQ threads each individually below measurable resolution at this sample rate. OneWifi is the largest single consumer at 0.55% (of total system capacity); onewifi_em_ctrl and onewifi_em_agent \u2014 despite their large and growing memory footprint (see memory-footprint companion file) \u2014 show minimal CPU activity here (0.01% each), consistent with idle/light-load conditions rather than active mesh operation. This remains an idle/light-load result; a loaded sample (EasyMesh formed, active Wi-Fi clients, sustained WAN throughput) has not yet been collected, and the profile's assumed hardware NAT/flow offload capability (see Section 3, CA-007) has not been confirmed or refuted by this measurement either way."
}
