{
  "$schema": "https://cpokuru.github.io/CoreRDK-Broadband-Platform/schemas/cpu-utilization.schema.json",
  "specVersion": "1.0",
  "profileId": "ext-easymesh",
  "measured": true,
  "referenceDevice": "Filogic tri-band Wi-Fi 7 EasyMesh extender (ARM64)",
  "measurementCondition": "60-second aggregate and per-process /proc/stat and /proc/<pid>/stat time-delta sample; all 4 cores online; light real-world background activity (OneWifi, snmpd, and napi/phy0 Wi-Fi softirq threads all show measurable, nonzero activity) but no controlled client/traffic load applied. Not a controlled multi-client or steering-load test.",
  "lastMeasured": "2026-09-17",
  "totalCpuPercent": 3.44,
  "processes": [
    {
      "process": "OneWifi",
      "cpuPercent": 0.66
    },
    {
      "process": "napi/phy0-15",
      "cpuPercent": 0.24
    },
    {
      "process": "snmpd",
      "cpuPercent": 0.22
    },
    {
      "process": "systemd",
      "cpuPercent": 0.16
    },
    {
      "process": "systemd-journal",
      "cpuPercent": 0.08
    },
    {
      "process": "ieee1905",
      "cpuPercent": 0.03
    },
    {
      "process": "napi/phy0-14",
      "cpuPercent": 0.02
    },
    {
      "process": "onewifi_em_agent",
      "cpuPercent": 0.01
    },
    {
      "process": "rtrouted",
      "cpuPercent": 0.01
    },
    {
      "process": "napi/phy0-17",
      "cpuPercent": 0.01
    },
    {
      "process": "napi/phy0-16",
      "cpuPercent": 0.01
    },
    {
      "process": "ntpd",
      "cpuPercent": 0.01
    },
    {
      "process": "syseventd",
      "cpuPercent": 0.01
    },
    {
      "process": "rdkbLogMonitor.",
      "cpuPercent": 0.01
    },
    {
      "process": "rdisc",
      "cpuPercent": 0.01
    },
    {
      "process": "sh",
      "cpuPercent": 0.01
    },
    {
      "process": "syslogd",
      "cpuPercent": 0.01
    },
    {
      "process": "mt76-tx phy0",
      "cpuPercent": 0.01
    }
  ],
  "othersCpuPercent": 1.92,
  "notes": "First real per-process CPU breakdown captured for this profile (prior captures had only the aggregate figure). Per-process percentages are normalized to % of total system capacity across all 4 cores, matching the aggregate figure's own normalization \u2014 NOT % of a single core, consistent with the same correction applied to the EthWAN WiFi Router companion file. othersCpuPercent (1.92%) covers kernel worker/softirq threads plus many near-idle kernel/IRQ threads individually below measurable resolution at this sample rate. OneWifi is the largest single consumer at 0.66% (of total system capacity); onewifi_em_agent \u2014 despite its extreme and growing memory footprint (see memory-footprint companion file, ~364 MiB) \u2014 shows minimal CPU activity here (0.01%), consistent with idle/light-load conditions rather than active mesh operation; this is notable given the process's memory size and worth re-checking once the memory growth is better understood. This remains an idle/light-load result; a loaded sample (active client traffic, steering) has not yet been collected."
}
